{
  "$schema": "../../schemas/source-record.schema.json",
  "affects": [
    "vibes",
    "market"
  ],
  "applicable_versions": [],
  "digest": null,
  "id": "SRC-SF-VIBES-2026",
  "notes": "Re-check before release-sensitive implementation or public claim.",
  "publisher": "Salesforce",
  "retrieved_at": "2026-08-19",
  "reviewed_at": "2026-08-19",
  "source_tier": 1,
  "status": "current",
  "title": "New Developer Edition: Agentforce Vibes, Claude, MCP",
  "url": "https://developer.salesforce.com/blogs/2026/04/new-developer-edition-agentforce-vibes-claude-mcp"
}
